{
  "$schema": "./docs/plugins.schema.json",
  "generatedBy": "scripts/generate-plugins-manifest.mjs",
  "repository": "https://github.com/xarleyn/dsh-plugins",
  "githubTopic": "dsh-plugin",
  "plugins": [
    {
      "name": "audit-core",
      "npm": "@yadsh/dsh-audit-core",
      "path": "packages/audit-core",
      "description": "Session audit artifact domain layer for DeepSeek Harness: schema, parsing, validation, summary and atomic publishing",
      "keywords": [
        "deepseek",
        "deepseek-harness",
        "dsh",
        "dsh-plugin",
        "cordis",
        "audit",
        "session-audit",
        "trajectory-evaluation"
      ],
      "kind": "library",
      "install": "pnpm add @yadsh/dsh-audit-core",
      "homepage": "https://github.com/xarleyn/dsh-plugins/tree/main/packages/audit-core#readme",
      "client": false
    },
    {
      "name": "audit-ui",
      "npm": "@yadsh/dsh-audit-ui",
      "path": "packages/audit-ui",
      "description": "Shared audit presentation components for DeepSeek Harness: sanitized report rendering, findings, scorecard and JSON view",
      "keywords": [
        "deepseek",
        "deepseek-harness",
        "dsh",
        "dsh-plugin",
        "cordis",
        "audit",
        "markdown",
        "react"
      ],
      "kind": "library",
      "install": "pnpm add @yadsh/dsh-audit-ui",
      "homepage": "https://github.com/xarleyn/dsh-plugins/tree/main/packages/audit-ui#readme",
      "client": false
    },
    {
      "name": "plugin-kit",
      "npm": "@yadsh/dsh-plugin-kit",
      "path": "packages/plugin-kit",
      "description": "Shared runtime helpers for DSH plugins: logging scaffolds, config validation, compatibility checks and SQLite store plumbing",
      "keywords": [
        "deepseek",
        "deepseek-harness",
        "dsh",
        "dsh-plugin",
        "cordis",
        "plugin-kit",
        "sqlite",
        "storage"
      ],
      "kind": "library",
      "install": "pnpm add @yadsh/dsh-plugin-kit",
      "homepage": "https://github.com/xarleyn/dsh-plugins/tree/main/packages/plugin-kit#readme",
      "client": false
    },
    {
      "name": "plugin-log",
      "npm": "@yadsh/dsh-plugin-log",
      "path": "packages/plugin-log",
      "description": "Shared structured file logging and runtime logger discovery for DSH plugins",
      "keywords": [
        "deepseek",
        "deepseek-harness",
        "dsh",
        "dsh-plugin",
        "cordis",
        "logging",
        "logs",
        "structured-logging",
        "observability"
      ],
      "kind": "library",
      "install": "pnpm add @yadsh/dsh-plugin-log",
      "homepage": "https://github.com/xarleyn/dsh-plugins/tree/main/packages/plugin-log#readme",
      "client": false
    },
    {
      "name": "dsh-answer-review-gate",
      "npm": "@yadsh/dsh-answer-review-gate",
      "path": "plugins/dsh-answer-review-gate",
      "description": "Independent answer review gate for DeepSeek Harness agent responses",
      "keywords": [
        "answer-review",
        "agent",
        "cordis",
        "deepseek",
        "deepseek-harness",
        "dsh",
        "dsh-answer-review-gate",
        "dsh-plugin",
        "quality-gate",
        "review-gate"
      ],
      "kind": "plugin",
      "install": "dsh plugin --profile <profile> add @yadsh/dsh-answer-review-gate",
      "homepage": "https://github.com/xarleyn/dsh-plugins/tree/main/plugins/dsh-answer-review-gate#readme",
      "client": false
    },
    {
      "name": "dsh-cas-results",
      "npm": "@yadsh/dsh-cas-results",
      "path": "plugins/dsh-cas-results",
      "description": "Content-addressed offload store for bulky DeepSeek Harness tool results",
      "keywords": [
        "deepseek",
        "deepseek-harness",
        "dsh",
        "dsh-plugin",
        "cordis",
        "tool-results",
        "content-addressed-storage",
        "deduplication",
        "context-management"
      ],
      "kind": "plugin",
      "install": "dsh plugin --profile <profile> add @yadsh/dsh-cas-results",
      "homepage": "https://github.com/xarleyn/dsh-plugins/tree/main/plugins/dsh-cas-results#readme",
      "client": false
    },
    {
      "name": "dsh-decision-tools",
      "npm": "@yadsh/dsh-decision-tools",
      "path": "plugins/dsh-decision-tools",
      "description": "DeepSeek Harness decision, classification, scoring and ranking tools for System One backends",
      "keywords": [
        "deepseek",
        "deepseek-harness",
        "dsh",
        "dsh-plugin",
        "cordis",
        "dsh-decision-tools"
      ],
      "kind": "plugin",
      "install": "dsh plugin --profile <profile> add @yadsh/dsh-decision-tools",
      "homepage": "https://github.com/xarleyn/dsh-plugins/tree/main/plugins/dsh-decision-tools#readme",
      "client": false
    },
    {
      "name": "dsh-doc-impact",
      "npm": "@yadsh/dsh-doc-impact",
      "path": "plugins/dsh-doc-impact",
      "description": "Deterministic documentation impact engine for DeepSeek Harness",
      "keywords": [
        "deepseek",
        "deepseek-harness",
        "dsh",
        "dsh-plugin",
        "cordis",
        "documentation",
        "impact-analysis",
        "docs"
      ],
      "kind": "plugin",
      "install": "dsh plugin --profile <profile> add @yadsh/dsh-doc-impact",
      "homepage": "https://github.com/xarleyn/dsh-plugins/tree/main/plugins/dsh-doc-impact#readme",
      "client": true
    },
    {
      "name": "dsh-documents",
      "npm": "@yadsh/dsh-documents",
      "path": "plugins/dsh-documents",
      "description": "Managed document pipeline for the DeepSeek Harness: Markdown to DOCX/PDF, DOCX/PDF back to Markdown, and online sources as agent tools",
      "keywords": [
        "deepseek",
        "deepseek-harness",
        "dsh",
        "dsh-plugin",
        "cordis",
        "documents",
        "docx",
        "pdf",
        "markdown",
        "ocr"
      ],
      "kind": "plugin",
      "install": "dsh plugin --profile <profile> add @yadsh/dsh-documents",
      "homepage": "https://github.com/xarleyn/dsh-plugins/tree/main/plugins/dsh-documents#readme",
      "client": true
    },
    {
      "name": "dsh-domain-experts",
      "npm": "@yadsh/dsh-domain-experts",
      "path": "plugins/dsh-domain-experts",
      "description": "Configurable domain-scoped expert agents for DeepSeek Harness",
      "keywords": [
        "deepseek",
        "deepseek-harness",
        "dsh",
        "dsh-plugin",
        "cordis",
        "domain",
        "expert",
        "subagent",
        "scoping",
        "agent-teams"
      ],
      "kind": "plugin",
      "install": "dsh plugin --profile <profile> add @yadsh/dsh-domain-experts",
      "homepage": "https://github.com/xarleyn/dsh-plugins/tree/main/plugins/dsh-domain-experts#readme",
      "client": true
    },
    {
      "name": "dsh-draft-sessions",
      "npm": "@yadsh/dsh-draft-sessions",
      "path": "plugins/dsh-draft-sessions",
      "description": "Persistent unsent draft sessions for DeepSeek Harness",
      "keywords": [
        "deepseek",
        "deepseek-harness",
        "dsh",
        "dsh-plugin",
        "cordis",
        "draft",
        "sessions",
        "web-ui",
        "autosave"
      ],
      "kind": "plugin",
      "install": "dsh plugin --profile <profile> add @yadsh/dsh-draft-sessions",
      "homepage": "https://github.com/xarleyn/dsh-plugins/tree/main/plugins/dsh-draft-sessions#readme",
      "client": true
    },
    {
      "name": "dsh-git-readonly",
      "npm": "@yadsh/dsh-git-readonly",
      "path": "plugins/dsh-git-readonly",
      "description": "Read-only git provenance tools for DeepSeek Harness agents",
      "keywords": [
        "deepseek",
        "deepseek-harness",
        "dsh",
        "dsh-plugin",
        "cordis",
        "git",
        "read-only",
        "provenance",
        "agent-tools"
      ],
      "kind": "plugin",
      "install": "dsh plugin --profile <profile> add @yadsh/dsh-git-readonly",
      "homepage": "https://github.com/xarleyn/dsh-plugins/tree/main/plugins/dsh-git-readonly#readme",
      "client": false
    },
    {
      "name": "dsh-humanizer",
      "npm": "@yadsh/dsh-humanizer",
      "path": "plugins/dsh-humanizer",
      "description": "Humanizer text rewriting tools for DeepSeek Harness agents",
      "keywords": [
        "deepseek",
        "deepseek-harness",
        "dsh",
        "dsh-plugin",
        "cordis",
        "dsh-humanizer"
      ],
      "kind": "plugin",
      "install": "dsh plugin --profile <profile> add @yadsh/dsh-humanizer",
      "homepage": "https://github.com/xarleyn/dsh-plugins/tree/main/plugins/dsh-humanizer#readme",
      "client": false
    },
    {
      "name": "dsh-jev-compaction",
      "npm": "@yadsh/dsh-jev-compaction",
      "path": "plugins/dsh-jev-compaction",
      "description": "Jev/System-One semantic pruning of stale tool results for DeepSeek Harness; keeps conversation text verbatim and forgets stale tool output before summary compaction is needed",
      "keywords": [
        "deepseek",
        "deepseek-harness",
        "dsh",
        "dsh-plugin",
        "cordis",
        "dsh-jev-compaction",
        "jev",
        "system-one",
        "compaction",
        "context-window",
        "session-surface",
        "result-shaping",
        "tool-output",
        "settings-card"
      ],
      "kind": "plugin",
      "install": "dsh plugin --profile <profile> add @yadsh/dsh-jev-compaction",
      "homepage": "https://github.com/xarleyn/dsh-plugins/tree/main/plugins/dsh-jev-compaction#readme",
      "client": true
    },
    {
      "name": "dsh-kv-persist",
      "npm": "@yadsh/dsh-kv-persist",
      "path": "plugins/dsh-kv-persist",
      "description": "Persistent KV-cache/session-state manager for DeepSeek Harness (llama.cpp slot snapshots)",
      "keywords": [
        "deepseek",
        "deepseek-harness",
        "dsh",